Motivation,Direction,PLEX1,PLEX2,PLEX3,PLEX4,PLEX5,PLEX6,PLEX7,PLEX8,PLEX9,PLEX10,PLEX11,PLEX12,FreeText,Total,cond,cond_dur,cond_clicks,TestDur
7,5,9,11,NA,NA,NA,NA,NA,NA,NA,NA,NA,NA,Confusing. What was the task?,17.2,Ctr,458.516,13,213.034
5,6,11,16,9,7,1,NA,NA,NA,NA,NA,NA,NA,"I did not have a strategy, I just pressed the buttons to see what would happen in each occasion. I found it memorable that when education increases, BMI,exercise, neuroticism and smoking habits decrease, while intelligence, social interactions and coffee consumption increase",16.2,Ctr,231.785,6,343.207
5,6,7,8,9,11,14,16,NA,NA,NA,NA,NA,NA,"Didn't really have a specific strategy, just tried clicking different traits to see how this influenced other traits. I tried clicking the same intervention several times, e.g. Depression, to see how much it would increase/reduce certain traits by - intervening on Depression seemed to influence all other traits, whereas intervening on other traits only influenced a select few of the other traits. Education influenced many traits, particularly Intelligence. I liked the way the arrows increased with speed as traits were repeatedly influenced, but sometimes it was so fast that you couldn't focus on which traits were being changed as a result of your intervention.",17.2,Ctr,43.378,6,250.99200000000002
6,5,14,15,4,8,1,NA,NA,NA,NA,NA,NA,NA,i found the effects of exercise and socialisation vast.,12.2,Ctr,9.187,2,161.429
9,9,3,7,8,9,14,NA,NA,NA,NA,NA,NA,NA,Not sure it worked properly for me as i was using a tablet so couldn’t ‘hover’ so was just clicking (pretty randomly) and seeing what changed and what had effects in what,16.4,Ctr,45.746,7,600.0730000000001
5,5,1,7,16,11,14,8,4,2,9,NA,NA,NA,"At first I hovered over the negative traits and followed lines of causation (what they were caused by). Then I tried to find common links between causes of bad traits, in order to reduce them. Increasing education had one of the most positive effects in reducing negative traits and increasing positive ones. I enjoyed the user interface and the challenge of the software.",15.2,Ctr,18.921,5,218.688
4,6,9,11,NA,NA,NA,NA,NA,NA,NA,NA,NA,NA,I didn't understand what I was supposed to do with the software.,15.2,Ctr,186.571,4,315.20799999999997
8,6,2,14,9,8,7,11,NA,NA,NA,NA,NA,NA,it was difficult to understand at first,16.2,Ctr,245.9,3,244.07599999999996
5,5,1,7,14,15,11,9,8,13,4,NA,NA,NA,"I had a few strategies like increasing education, socialization and excercise, etc as interventions. At times, I felt a bit confused so I wasn't achieve somethings like reducing neuroticism. I found the effect of reducing coffee intake on insomnia memorable. I don't really have any opinions regarding the presentation.",12.2,Ctr,60.958,3,370.363
5,6,13,16,14,8,9,7,1,NA,NA,NA,NA,NA,"Personally, at my first try I did not have any strategy and tried to understand the software. But in my second try, I began to observe how interventions generally had an effect and tried to form a strategy.",16.2,Ctr,378.703,2,380.395
5,7,9,7,NA,NA,NA,NA,NA,NA,NA,NA,NA,NA,I felt the sofware was hard to use. I did however find it enjoyable dragging the different factors around and seeing the increase/ decrease.,16.2,Ctr,216.827,9,279.531
7,10,8,11,7,16,NA,NA,NA,NA,NA,NA,NA,NA,"i did not have any sort of strategy when using the software, also i did not particularly find the effects very memorable",18.2,Ctr,52.297,14,268.313
4,4,16,7,9,NA,NA,NA,NA,NA,NA,NA,NA,NA,"I enjoyed clicking on different elements and seeing their effect. However, some effects happened so quickly that it was hard to follow and I did not find all interactions particularly memorable.",15.2,Ctr,35.441,5,181.54
9,10,NA,NA,NA,NA,NA,NA,NA,NA,NA,NA,NA,NA,didnt really understand it at all,18.2,Ctr,28.235,3,218.305
8,8,1,9,2,7,NA,NA,NA,NA,NA,NA,NA,NA,I might've done something wrong because it got very confusing and that gave me anxiety.,19.2,Ctr,98.196,2,236.798
6,9,16,13,11,9,8,4,7,2,1,3,NA,NA,"I found the simulation quite confusing at first, but then I got the hang of it. I still was a bit lost when a ripple effect was caused by a single intervention though, as the changes were expressed simultaneously and I simply couldn't keep up. I thought it was a fun game though!",16.2,Ctr,14.376,3,265.84
5,6,1,2,7,9,13,15,NA,NA,NA,NA,NA,NA,"I did not really understand what we were supposed to do, and wasn't sure if I was doing the right this, but was fun. It all seemed like common sense, but you don't really realise how many things can affect or be affected by one this. Presentation was fairly good, maybe bigger scale?",19.2,Ctr,447.789,4,303.351
NA,NA,NA,NA,NA,NA,NA,NA,NA,NA,NA,NA,NA,NA,NA,NA,Ctr,32.196,4,0
7,8,1,3,9,14,11,4,7,2,NA,NA,NA,NA,I think the effects are not quite memorable because the animation of how things interact is too quick and lacks explanation so I did not quite catch up with it.,19.2,Ctr,553.654,4,426.211
5,6,4,7,14,9,8,NA,NA,NA,NA,NA,NA,NA,"I did not approach the software with a strategy. I noticed that increasing education would decrease exercise and increase eveningness, this was memorable for me as i found myself thinking back to times where i had stayed up to study or had forfeited exercise or walks to study. In my opinion, the presentation was a little bit messy as the arrows intersected a lot and caused confusion occasionally. However, i did like that hovering over the icons would show you which trait was directly linked to it. This provided some clarity as to which factors I was impacting.",15.2,Ctr,346.847,2,456.43600000000004
5,6,7,9,11,8,3,16,NA,NA,NA,NA,NA,NA,"At first I found the software confusng, however after getting the hang of it I started developing strategies to improve the overall health.",18.2,Ctr,15.698,3,207.81900000000002
6,5,16,9,7,8,1,14,NA,NA,NA,NA,NA,NA,"It was interesting to use and made key relationships easy to explore. I did find it difficult to understand the overarching aim of the software and what my true 'goal' was. I thought it was memorable, as the relationships were shown in a visually appealing way that caught my attention.",14.2,Ctr,383.712,2,273.882
4,6,8,9,11,16,15,14,13,3,7,NA,NA,NA,Reduced all bad traits first,16.2,Ctr,17.842,3,295.319
6,6,1,16,2,15,13,14,11,7,4,9,NA,NA,really enjoyed it,12.4,Ctr,10.801,2,160.22500000000002
4,7,7,9,16,15,13,3,1,NA,NA,NA,NA,NA,"I thought that it was really engaging and interesting. I manipulated postive areas e.g ""education"" to notice the impact of an increase education, and also tried the other approach of trying to reduce negative ones such as ""insomnia"", which is probably less practical, but the impact was dramatic in terms of mental health outcomes. I think it could be improved with more prompts in the UI or help section. The only limitation was not being able manipulate all areas easily with interventions. So interesting and fun though!",13.2,Ctr,453.567,2,419.374
6,8,2,3,8,9,11,7,14,NA,NA,NA,NA,NA,I did not have a strategy.,14,Ctr,48.609,7,170.00799999999998
7,7,9,7,1,11,NA,NA,NA,NA,NA,NA,NA,NA,I thought it was a very good experience,13.2,Ctr,99.795,8,338.44100000000003
6,6,16,8,9,11,14,15,1,NA,NA,NA,NA,NA,i liked the little arrows- i was pretty motivated to make changes and i enjoyed it. I dont think i really learned anything that wasnt common sense though,17.2,Ctr,13.45,3,147.81900000000002
5,9,4,7,11,13,9,8,15,NA,NA,NA,NA,NA,"It felt a bit buggy at times, but enjoyed the reactions and ease of access",14.2,Ctr,384.563,5,253.96200000000002
6,6,15,13,14,16,11,7,3,4,1,2,NA,NA,I donot have a strategy,18.2,Ctr,45.986,4,363.019
6,5,2,7,8,9,13,15,14,NA,NA,NA,NA,NA,"At first I did not have a strategy and I was a bit confused about the software. I still feel like it's a bit hard to understand and difficult to achieve a specific goal. I find it very interesting how every thing affects and has an impact on a lot of other things, that I wasn't even aware of.",17.2,Ctr,39.794,4,478.019
6,6,1,2,7,8,9,NA,NA,NA,NA,NA,NA,NA,"no strategy, education had a noticeable impact on majority of the bad items",15.2,Ctr,627.828,8,266.707
6,6,14,9,13,8,7,2,1,NA,NA,NA,NA,NA,Found it a bit confusing but interesting,15.2,Ctr,206.278,3,309.88300000000004
5,6,15,16,11,9,8,1,7,NA,NA,NA,NA,NA,"I found it quite complicated to begin with, I didn't have a strategy other than to experiment with it. The effects were memorable and it was nice to see how they all interlinked.",17.2,Ctr,353.062,3,228.441
5,5,14,9,15,7,NA,NA,NA,NA,NA,NA,NA,NA,The presentation was easy to interact with and interesting to work around,17.2,Ctr,10.589,3,210.79
8,7,4,11,16,7,9,NA,NA,NA,NA,NA,NA,NA,"Whilst I was confused at first after I somewhat understood the point of the task and began moving things it became quite thought provoking. I had no particular strategy, just made sure to click on each icon and move it appropriately. The noise effect was very memorable and stood out to me the most. Good presentation, lots of colour used appropriately, however, it was confusing following all the arrows' placements.",17.2,Ctr,28.317,4,391.40700000000004
4,4,3,4,8,9,11,16,2,13,NA,NA,NA,NA,"trial and error strategy, I found the noise effects memorable and I thought the presentation was easy to follow",7.4,Ctr,13.751,3,50.5
4,4,15,16,9,13,7,1,4,NA,NA,NA,NA,NA,I found the experience very enjoyable. I didn't have a specific strategy; I just tried to implement interventions that I thought would cause the most widespread effects. I enjoyed watching the chain-reactions of some of my decisions.,16.2,Ctr,942.588,7,495.313
5,6,4,14,11,16,9,7,8,1,NA,NA,NA,NA,"I was mainly trying to induce positive effects. I would get frustrated if I was trying to do that and other factors on the task stopped that from happening. I think it was an interesting presentation and found it overall enjoyable, although it took a while to grasp and I did find it looked confusing at first",15.2,Ctr,165.263,4,239.76
8,8,8,15,1,9,NA,NA,NA,NA,NA,NA,NA,NA,"At first I found it a little confusing to work and didn't really understand the aims behind it. However, once I started seeing how the relationships could change through modifying certain things, I felt there was more purpose to what I was doing and understood the relationships far better.",16.2,Ctr,36.176,3,251.26999999999998
6,5,4,15,14,11,9,7,3,2,NA,NA,NA,NA,The software was definitely interactive and stimulating which i found encouraged me to seek out the best possible outcomes,13.8,Ctr,36.777,3,155.811
5,5,1,2,4,8,9,13,NA,NA,NA,NA,NA,NA,not really. i think it was very exciting and i enjoyed it,14.6,Ctr,81.023,16,600.923
5,6,8,13,16,1,9,7,11,NA,NA,NA,NA,NA,"I found the software quite simple. It had no ending and I could leave it at any time, and this made me feel like the software didn't have an aim or achievement in the end.",14.2,Ctr,52.29,9,482.19399999999996
8,5,15,11,7,4,2,1,9,NA,NA,NA,NA,NA,No strategy but the use of educations affect was memorable,13,Ctr,43.513,7,380.097
8,5,9,NA,NA,NA,NA,NA,NA,NA,NA,NA,NA,NA,"It was slightly confusing, sometimes the colours faded and the arrows got huge. Also, some them had nothing happen after. I just clicked on ones that interested me and then clicked on another one. The presentation was good, my only problem was that it was slightly overwhelming and at time unclear.",16.2,Ctr,72.487,7,469.855
5,8,2,9,14,7,NA,NA,NA,NA,NA,NA,NA,NA,"I found it really confusing. The more I played around with it, the more clear it became but I still struggled. I therefore didn't really have a strategy",14.2,Ctr,19.737,3,180.435
5,5,1,9,11,13,16,3,7,2,8,NA,NA,NA,"the sounds were interesting, the presentation was intense",15.2,Ctr,20.476,2,438.193
5,5,15,11,16,7,9,NA,NA,NA,NA,NA,NA,NA,"I think it was really engaging how I was able to click and hover over the different icons and see how one affects another. I think some of the effects, especially the effect of education on health conditions, is very memorable. I did not have a proper strategy but I tried to look for the things that were indicated at the beginning such as the effect of education and the correlation between BMI and heart diseases.",17.2,Ctr,202.199,4,346.65999999999997
6,6,2,9,14,NA,NA,NA,NA,NA,NA,NA,NA,NA,i thought it was very well thought out and i found it enjoyable and visually pleasing,12.2,Ctr,60.992,24,166.45499999999998
4,5,16,NA,NA,NA,NA,NA,NA,NA,NA,NA,NA,NA,Increasing education and exercise in order to promote healthy sleeping scheduled and to keep bmi and heart illness down.,14.2,Ctr,51.816,4,201.918
5,5,2,7,9,1,11,NA,NA,NA,NA,NA,NA,NA,I mainly focused on the aspects that most related to my life such as education to see if I follower the patterns of the health effects such as coffee and sleep which was really interesting,16.2,Ctr,26.955,3,280.928
6,5,16,7,8,11,14,9,4,13,NA,NA,NA,NA,The visual of the software made it clear how these aspects of life are intertwined even more than we tend to comprehend. One change would set off multiple others and drastically alter the system.,17,Ctr,10.046,2,229.758
6,6,13,2,9,16,NA,NA,NA,NA,NA,NA,NA,NA,very visually stimulating which made it more exciting to interact with. It was interesting and to some extent satisfying to see the kind of wide-spread effect that one intervention could have.,16.2,Ctr,13.093,3,491.975
9,8,3,4,9,14,11,7,2,1,13,NA,NA,NA,no,15,Ctr,54.622,6,752.45
NA,NA,NA,NA,NA,NA,NA,NA,NA,NA,NA,NA,NA,NA,NA,NA,Ctr,106.449,27,0
5,5,16,7,9,11,1,8,NA,NA,NA,NA,NA,NA,I didn't have a strategy initially I just explored the different interventions and when I had more of an idea of how the software worked I reset it and started again this time trying to do the biggest interventions first. I think the effects were memorable at the beginning however they went very fast sometimes and were harder to follow. Overall I liked the presentation as I think it was good to learn visually rather than by reading.,18.2,Ctr,26.399,3,273.267
5,5,14,15,11,8,9,7,16,NA,NA,NA,NA,NA,I think it shows a clear representation of how the mind and body are linked and how tackling mental health can affect physical symptoms and vice versa.,13.2,Ctr,16.553,3,259.194
7,7,NA,NA,NA,NA,NA,NA,NA,NA,NA,NA,NA,NA,"It was very confusing, I didn't know what to expect and instructions were unclear. I think this software could be very helpful to see a chain of effects as a result of certain behaviours. I did not have a strategy as I didn't know what the aim was or what I was trying to achieve.",14.2,Ctr,21.341,3,708.5229999999999
7,7,15,9,13,4,7,NA,NA,NA,NA,NA,NA,NA,I found it interesting but the presentation was slightly confusing and hard see individual components,18.2,Ctr,254.797,3,267.539
5,7,2,7,9,15,11,16,NA,NA,NA,NA,NA,NA,i thought it was very visually pleasing that made it seem more like a game therefore it was more interactive and so i felt more inclined to try things out.,15.2,Ctr,19.228,3,462.656
5,5,15,16,9,11,2,1,7,NA,NA,NA,NA,NA,"I did not have a strategy, I just explored the software and experimented by changing diffrent things and seeing what affect this would have.",17.2,Ctr,21815.333,4,242.052
4,4,8,14,1,9,NA,NA,NA,NA,NA,NA,NA,NA,I quite like the way it was presented as you can see how a series of variables all interact with one another,15.2,Ctr,38.461,3,221.082
7,6,1,2,9,7,NA,NA,NA,NA,NA,NA,NA,NA,It was quite confusing but was interesting layout e.g. not just words on a screen,12.2,Ctr,33.03,4,246.55200000000002
6,6,9,11,13,14,7,8,NA,NA,NA,NA,NA,NA,No strategy; very nice graphics,18.2,Ctr,143.07,4,253.368
6,5,9,11,14,1,16,7,NA,NA,NA,NA,NA,NA,I focussed on the educational aspect and health as they seemed to have several positive effects. I enjoyed the visuals of the presentation although found the arrows a little confusing and when i moved any of the bubbles it would make the whole thing look like a mess.,17.2,Ctr,26.644,3,189.531
5,6,16,2,14,11,7,NA,NA,NA,NA,NA,NA,NA,I don't think I fully understood how to use it. It was interesting to see how different mental health outcomes are influenced by health choices.,15,Ctr,33.425,4,268.181
6,5,16,2,7,8,15,13,NA,NA,NA,NA,NA,NA,"slightly confessing, didn't fully understand how to reduce certain experiences. overall good layout and easy to manage.",13.6,Ctr,14.76,2,151.101
5,4,1,9,15,14,7,16,NA,NA,NA,NA,NA,NA,I enjoyed using this software and found it very interactive. I tended to try and separate out certain factors and have a look at which factors were linked to lots of other factors. I think for some people they may find it overwhelming to look at as there is quite a lot going on within one diagram. Although for people who are visual learners it would definitely have a big effect. I think it was quite memorable seeing the effects of insomnia and sleep on your well-being and how all these factors link to one another.,12.2,Ctr,78.822,3,400.56
9,9,7,9,14,NA,NA,NA,NA,NA,NA,NA,NA,NA,I found the software very confusing and difficult to operate. I didn't have a strategy other than trying to investigate the individual items that were shown.,14,Ctr,39.017,3,445.744
5,8,8,11,13,9,2,16,1,NA,NA,NA,NA,NA,"At the beginning I didn't really know what to do, so it was fun to learn how everything worked on my own. I also started paying more attention to what I was choosing, and it made the whole game more challenging as there were many links between the traits.",18.2,Ctr,357.167,12,550.1759999999999
6,6,15,9,7,16,NA,NA,NA,NA,NA,NA,NA,NA,"I liked the presentation of the software, however think there could of been clearer instructions and tasks to do. It was interesting to see what decreasing alcohol intake did to intelligence as well as BMI",14.2,Ctr,17.913,2,289.966
4,4,1,15,14,13,9,11,8,7,NA,NA,NA,NA,"I intervened more with the negative traits which had thick arrows to other traits, as that showed that there was a stronger relationship between those two traits. I found it somewhat surprising in some occasions when i Intervened and the effect was so widespread amongst so many different traits/behaviours. I thought that the presentation was clear and effective. I enjoyed seeing all the domino effects that intervening with a singular trait created across multiple different traits.",18.2,Ctr,21.997,5,217.585
5,5,15,16,1,9,NA,NA,NA,NA,NA,NA,NA,NA,"presentation was really nice- really cool to see the links between all the traits at once and all their interconnections. Didn't have a strategy, just explored, nothing prevented me from achieving what i wanted.",16.2,Ctr,31.391,3,445.139
6,5,16,1,7,9,14,NA,NA,NA,NA,NA,NA,NA,I started by getting to know the software and what each button would do and then I targeted interventions to improve wellbeing and increase it while lowering negative traits like depression. The software was unlike anything I have used before so it was memorable and fun to play around with it and I liked the fact that it was something new. I think it is memorable as I can still picture it in my head/visualise it.,15.2,Ctr,751.617,9,213.33999999999997
4,5,1,11,14,9,7,8,3,2,4,NA,NA,NA,In order to make the interventions I looked at all of the different things I could do to intervene. Education was the thing that affected all of the others the most and so I kept clicking that one in order to improve others e.g. intelligence.,15.2,Ctr,9.958,2,237.51600000000002
7,6,14,11,9,3,8,NA,NA,NA,NA,NA,NA,NA,"It was crazy to see how one thing could have an effect on so many other things (for example by just decreasing depression by 1% we decreased neuroticism, worry, loneliness, insomnia leading to an increase in wellbeing which in turn led to an increase/decrease in many more aspects). Having experienced mental health problems and having seen a massive increase in overall wellbeing myself my strategy at the beginning was to decrease depression, worry and loneliness to visually see how that has an effect on other domains. I then focused on additions rather than subtractions (e.g. increasing education). Although I was already aware of the effects (e.g. decreasing alcohol consumption decreasing insomnia, BMI etc.) the presentation makes it easier to make the links between all these things (especially if you're a visual learner like me) and personally I've found it useful especially since you can see percentages too.",15.2,Ctr,318.875,12,216.16899999999998
NA,NA,NA,NA,NA,NA,NA,NA,NA,NA,NA,NA,NA,NA,NA,NA,Ctr,176.576,4,0
7,8,14,15,9,8,7,3,NA,NA,NA,NA,NA,NA,Intuitive choices,15.2,Ctr,88.543,4,338.324
5,6,9,11,16,15,1,7,13,NA,NA,NA,NA,NA,Excellently presented. I sought out the education 'marker' and moved it to the top to form a hierarchical structure. Great reminder to get more and better sleep and to keep exercising!,17.2,Ctr,796.783,2,1151.341
10,10,14,16,NA,NA,NA,NA,NA,NA,NA,NA,NA,NA,I found the package very interactive and easy to use. It was fun. I liked the visualisation of the intevrentions,16.2,Ctr,82.615,3,229.703
6,9,2,9,NA,NA,NA,NA,NA,NA,NA,NA,NA,NA,Bit confusing,15.2,Ctr,290.184,4,335.081
6,5,7,16,1,9,11,15,NA,NA,NA,NA,NA,NA,"I was mostly motivated through my curiosity to see causal relationships. However, curiosity soon subsided and lack of goal or challenge made me lose interest. Perhaps if I had a limited number of ""interventions"" to try have the greatest impact I would be more invested. I liked seeing the ""chain reaction"" especially as it sped up on the more effective interventions. Presentation was good. It would of been nice to be able to rotate the simulation to orientate it how I rather than just dragging the traits (I'm aware this is quite a tall order).",14.2,Ctr,978.417,11,432.77700000000004
4,5,11,15,14,13,9,16,1,8,7,2,NA,NA,I actually really enjoyed using the software as I found that I wasn only focusing on the task at hand and my mind was not overthinking or wandering as usual.,14.2,Ctr,871.778,15,272.336
6,5,9,16,8,7,NA,NA,NA,NA,NA,NA,NA,NA,"Very explorative, just testing out the result of different interventions without particular strategy",13.2,Ctr,25.402,3,264.216
6,8,1,2,14,11,4,9,7,NA,NA,NA,NA,NA,"I didn't quite know what I was doing most of the time, but in the end I kept clicking education which got bigger and reduced a lot of the things classified as bad. I had no strategy, I just clicked the 'good' things as I didn't quite know what I was doing despite reading the instructions. the presentation was a bit confusing, it could have been a bit clearer, taking up the whole screen with not so many arrows",14.2,Ctr,33.586,3,159.987
4,4,8,9,13,15,14,7,4,16,NA,NA,NA,NA,"It’s very interesting and funny. However, I think a few more trait can be added such as obrsity, fear and altruism to make this system more complete.",15.2,Ctr,644.96,39,417.08299999999997
4,4,8,13,16,14,11,9,7,NA,NA,NA,NA,NA,It was very interesting to see how one thing can affect many others. We are usually not aware of all the consequences of an action and this software makes you really understand this,15.2,Ctr,368.345,3,326.305
6,6,2,7,8,13,14,9,11,16,NA,NA,NA,NA,it was kind of confusing,16.2,Ctr,36.043,3,459.03
7,7,9,7,1,NA,NA,NA,NA,NA,NA,NA,NA,NA,i just tried to move things arround and see how other elements were affected,14.2,Ctr,22.923,4,346.39300000000003
5,5,16,15,13,9,8,1,14,NA,NA,NA,NA,NA,It was interesting to look at the interactions between a range of different things which effect day to day life,17.2,Ctr,22.779,3,369.999
4,5,2,8,14,15,13,16,4,NA,NA,NA,NA,NA,I did not use a specific strategy I moslty clicked on the interventions I was interested in the most,NA,Ctr,32.03,3,0
4,5,8,15,14,7,1,9,NA,NA,NA,NA,NA,NA,"The strategy adopted was to focus on core interventions, before focusing in on smaller elements to mitigate the side-effects of larger interventions and further enhance their strength",14.2,Ctr,292.741,5,540.558
5,6,16,7,9,11,13,NA,NA,NA,NA,NA,NA,NA,"nope, i was confused initially, i thought you could change whetehr you wanted to increase or decrease the effects as opposed to only do them one way.",16.2,Ctr,18.087,3,235.173
NA,NA,NA,NA,NA,NA,NA,NA,NA,NA,NA,NA,NA,NA,NA,NA,Ctr,240.218,3,0
5,5,13,9,15,7,8,NA,NA,NA,NA,NA,NA,NA,"It went really faster after a while, but the pictures and diagram were really interactive",14.6,Ctr,88.057,11,274.368
9,6,3,4,11,8,9,7,2,1,16,NA,NA,NA,I found it confusing what I could and coulnd't clicke and how some of them weren't linked to certain goals,14.2,Exp,2788.963,5,138.71699999999998
9,9,13,16,8,9,NA,NA,NA,NA,NA,NA,NA,NA,it was very complicated,10.2,Exp,141.646,3,177.54000000000002
5,5,7,8,9,11,15,16,1,NA,NA,NA,NA,NA,didn't feel anything was at stake so had no trouble guessing without mercy,14,Exp,932.032,3,166.127
9,5,16,15,3,8,1,NA,NA,NA,NA,NA,NA,NA,Looked at the arrows to see associations and payed attention to the computers choices. The software was clean and well presented but I did quickly get bored as it felt like I was doing the same thing over again with no real purpose.,6.2,Exp,7681.329,4,219.133
5,4,9,16,13,15,NA,NA,NA,NA,NA,NA,NA,NA,"I liked the space theme and my task. However, it was hard to tell what I had just done. For example, I'd forget which trait I just intervened on and it was tricky to figure out why I was successful or not in the task. The icons would move and be highlighted which was confusing and often frustrating when I was trying to finish the task.",15.2,Exp,1406.371,3,222.34
4,4,9,16,14,15,8,4,3,2,1,NA,NA,NA,I just tried to follow the links to see which one would have the bigger outcome and affect on the named factor,19.2,Exp,97.636,3,189.24200000000002
6,7,1,2,11,16,9,8,7,3,NA,NA,NA,NA,I wasn't clear on why I was progressing so there was no strategy. I liked the look and feel just wish I'd be able to understand it better.,13.2,Exp,100.683,3,283.214
7,8,11,9,16,NA,NA,NA,NA,NA,NA,NA,NA,NA,I did not really enjoy the software because I do not think it was clear enough about how to win. This may of been because I did not have strategy though.,19.2,Exp,975.524,6,169.54500000000002
